{"$schema":"https://json-schema.org/draft/2020-12/schema","type":"object","additionalProperties":false,"required":["schema_version","status","freeze_binding","phases","populations","primary_unit","outcomes","contrasts","models","missingness","multiplicity","stage1_progression","analyses","controls","cost","non_estimability","promotion_allowed"],"properties":{"schema_version":{"const":"translation-statistical-analysis-plan-v1"},"status":{"const":"prospective_planning_only_re_freeze_required_for_empirical_use"},"freeze_binding":{"type":"object"},"phases":{"type":"array","minItems":3},"populations":{"type":"object"},"primary_unit":{"type":"string","minLength":1},"outcomes":{"type":"array","minItems":7,"items":{"type":"object","required":["id","formula","direction"]}},"contrasts":{"type":"array","minItems":2},"models":{"type":"object"},"missingness":{"type":"object"},"multiplicity":{"type":"object"},"stage1_progression":{"type":"object"},"analyses":{"type":"array","minItems":10,"maxItems":10,"items":{"type":"object","required":["id","phase5_task","method","limit"]}},"controls":{"type":"object"},"cost":{"type":"object"},"non_estimability":{"type":"array","minItems":4},"promotion_allowed":{"const":false}}}
